{"capsule_id":"018f05d4-54fb-72aa-aa2a-2a2a2a2a2a2a","evidence":[{"content_type":"text/plain","kind":"diagnostic","state":"collected"}],"extensions":{"foo":{"spec_context":{"packet_path":"specs/bug-capsule-v0","provenance":"reporter_observed","requirement_ids":["R-001"],"revision":"2026-07-19","spec_id":"bug_capsule_v0","task_ids":["T-001"]}}},"failure":{"class":"io_error","classification":"known","classifier_version":"0.1","code":"E_IO","message":{"state":"collected","value":"EACCES: permission denied"},"stack":{"state":"collected","value":"Error: EACCES\\n    at status (cli.js:1:1)"}},"invocation":{"command":"foo asp status","runtime":{"arch":"arm64","node":"22.0.0","platform":"darwin"}},"links":[],"occurred_at":"2026-07-19T00:00:00.000Z","producer":{"name":"foo","version":"0.1.25"},"product":{"component":"cli","name":"Foo","version":"0.1.25"},"report":{"actual":{"reason":"automatic failure capture","state":"not_collected"},"expected":{"reason":"automatic failure capture","state":"not_collected"},"reproduction":{"reason":"automatic failure capture","state":"not_collected"}},"schema_version":"0.1","similarity":{"signals":[{"kind":"error_fingerprint","value":"a1b2c3d4e5f6"}],"version":"0.1"}}